,Unnamed: 0,citingPaperID,source,string,label,sentiment
51,5043,7ea35436e261fc4d48fdcada0a8eb9c1f8c1a93b>25aa4a143d373d371cc8fa3a2d550a0649d8c94c_6,explicit,"Prdm1 (encoding Blimp-1) has known roles in effector CD8+ and CD4+ T cell differentiation (Rutishauser et al., 2009; Shin et al., 2009; Johnston et al., 2009).",background,neutral
52,5909,c1d1ba9da89759f1178e7141236a882d32511aad>459d668bd488edf95b2d885a353327651e866cab_1,explicit,"Cochrane Collaboration tool for assessing risk of bias was used to assess the quality of randomized controlled trials, using the following criteria: (1) randomization sequence generation: assessment for selection bias; (2) allocation concealment: assessment of selection bias; (3) level of blinding (blinding of participants and blinding of outcome assessment): assessment for performance bias and detection bias; (4) incomplete outcome data: assessment for attrition bias; and (5) selective reporting: assessment for reporting bias.",method,neutral
53,6416,3574f9f77adaebe18c1760391b24f7aaaee989b7>1e8a03c8202aa081c8c02a50209750c5025b21eb_3,explicit,"This research used the prediction function of Sutheebanjard and Premchaiswadi [5] where the important factors namely, the Down Jones index, the Hang Seng index, the Nikkei index and domestic MLR were taken into account as shown in (2).",method,neutral
54,1600,ef1535a64b39c591db87e3d82fb7128a8f39480b>c923028caac7d0f58db911a22a89a003e10453bb_3,explicit,"However, the mechanisms of this effect are controversial (1, 2, 46, 53, 57).",background,negative
55,7609,a6871ce163edc9489345949276cda426e9f6a5be>2c03df8b48bf3fa39054345bafabfeff15bfd11d_2,explicit,"It has become a standard component in most prevalent CNN architectures like Inception [27], ResNet [8], DenseNet [13], etc.",background,positive
56,6521,4c767ca1fbb95353babb3260cb7151bbdf52afb8>55c013d531b2f41e9583f6c299991ef0e7c9cc25_0,explicit,It is possible that inflammation of the lymphatic vessels and cisterns provokes an increase in their endoluminal pressure and permeability of the walls leading to extravasation of chyle [3].,background,neutral
57,3482,7dac242a1e8bdb2e124d85621f7534729c2677c3>1e126cee4c1bddbfdd4e36bf91b8b1c2fe8d44c2_0,explicit,"To measure the power consumption of each application and component, we used an open source software called PowerTutor [98] and a profiling tool, called Trepn, provided",method,neutral
58,5742,69b6f12f183acc83abda96fc73a67e2f14b06fd6>cbaa08a512344a4389f1f86394030098c4c94201_4,explicit,"Mechanistically, gametic and somatic DMRs both require the maintenance of DNA methylation by DNMT1 (Caspary et al., 1998; Bhogal et al., 2004).",background,neutral
59,5051,1ff60378a82129e91fc666cb49e6da443bf90ef0>a61e519bb3d4233e90853cef8af02645e03dff51_0,explicit,"Additionally, several authors have reported cases where prolactin secreting adenomas either came to diagnosis or increased in size after exogenous estrogen administration or during pregnancy [4,5,7,8,9].",background,neutral
60,3242,427bb5862e0959be8928e90589e13fec56c74d71>3e2e7f25cea8ff585c4a64a0ddbfaba480de939e_0,explicit,"we take one real DHT system Kad [1] as a case for study, which is the first widely-deployed Kademlia-based [17] DHT file-sharing system.",method,neutral
61,4803,11dba738253fd6d6461fc50e825b1fec7f94272e>15b2c44b3868a1055850846161aaca59083e0529_4,explicit,"If we choose a sufficiently large β which eliminates consistencies between all worker pairs, Algorithm 1 collapses to the traditional semi-supervised algorithm [25] by treating all workers independently.",background,neutral
62,4300,17b98b22c58c8f866f3fe0309e4d8c093ca4b9e5>b6dc56a836abe295e634fd86430f55d61340aab0_0,explicit,"Notice that PCA can be seen as the basis of several other multivariate data analysis methods such as PLS (McIntosh et al., 1996; Lobaugh et al., 2001), whereby it is restricted to the brain–behavior covariate matrix.",method,positive
63,8126,36d8b1280c0caa03fc822ad25b285f84e277f559>16526f63b609525a5a0d8488d23b9131b3587000_3,explicit,The distribution of Lagrangian coherent structures (LCS)—the flow boundaries in unsteady flows—can be further extracted as the ridges in stochastic FTLE fields [2].,background,neutral
64,5022,003e38ee14dc45f8891a18cf88c7eda777068722>e4171536c5b311b3ccc4f8b443c469e9f7aee72a_3,explicit,"We include treatment with an angiotensin-converting enzyme inhibitor and thiazide diuretic for those without CVD or cerebrovascular disease history, while including beta-blockers for those with such a history, as per WHO guidelines further detailed in Text S1 [16,25].",method,neutral
65,6367,068a52bf5ebf8cb5db2f87202ca75892f4919a59>26e2fdaa5f12e8159ef0114f2672d7385a750f14_0,explicit,"Under simplifying assumptions, we have analytically shown how disynaptic inhibition that is as fast as mono-synaptic excitation can extend the effective range of inhibitory interactions, in contrast to the recent analytical results showing that in the case of equal synaptic delays on all connections the disynaptic inhibition has negligible effects (Muir and Cook, 2014).",result,positive
66,5860,676b19ba1c40fedf4d27a3f48a766ac20b960f8e>fe2fd3262b549d1b36898127e3cc7ca1c1dd3646_3,explicit,"These data are consistent with the previously demonstrated defect of ubc9-1 mutants in the degradation of Clb2 and Clb5 (Seufert et al., 1995).",result,positive
67,7866,f8d4caa3bf0ef1308a635de03306667c2d1842a0>ce4c42b904b1ceeaf10b95f09012055d3dbb593e_4,explicit,"The drift was removed because it would produce exaggerated standard deviation (SD) of force values not representative of the fluctuations of interest (39,46).",background,neutral
68,220,647823499c6005e03e1bdf6466658743d477a93f>1739224ec2e32b10e7a2b1eef63e9a1a86cadd67_1,explicit,"In a second experiment, ten Antarctic prions were rendered anosmic using an injection of zinc sulphate solution into the olfactory chambers (Bonadonna et al. 2001), and ten other birds, acting as controls, were sham-treated.",method,neutral
69,4734,5d75e5e67306c31d0ae13b1151efc3726bd35284>ff5613a5d976d776c0126bd3a06da23a17ceba38_2,explicit,"UV A radiation is absorbed by DNA and reacts with non-DNA chromophores, leading to formation of reactive oxygen species (ROS) which damage DNA, proteins, and lipids in the skin [4,5].",background,neutral
70,1711,2f575fc25a52bb3fac5fc8bc95982fa90413505d>5e5d226c19a3c148d9573770c2d864ba85b2b45e_0,explicit,"Statistics\n G-tests of interdependence (Sokal and Rohlf 1981) were used to compare overall activity, locomotor, posture, and support-use profiles (Doran 1992, 1993; McGraw 1996, 1998a, b; Dunham and McGraw 2014).",method,neutral
71,796,2ab057d0cdf27726b44454e4a35184a46bb1215a>95d818f089f256ffdfabbcb1157a3701ab1bd15e_9,explicit,"…forests through important stand development phases (for example, establishment, canopy closure, age-related declines in stand productivity) to examine whether the early stimulation of plant productivity by elevated CO2 persists as stands\nmature after reaching maximum productivity (Körner 2006).",background,neutral
72,517,808479d5e6444570fbbe20eac0ebbb2d40880804>421e726061a05c40f3d488b6b5189cc5de0b36f1_1,explicit,"Minimizing the first two terms of equation 6.7, which are\n7 This mechanism was proposed in Amari (1977) and Pouget and Zhang (1997).\nof order 1, determines that the stable state is on the line attractor.",background,neutral
73,6173,f7a458748ce8daca1930912c26285ca39a36ad82>ae68f41cc1cf623107fc3535caa245090003ba03_4,explicit,"The pCEFLHA-HMGA1, pCEFL-HA-HMGA2, pCEFL-HA-HMGA1 (1–43) and pCEFL-HA-HMGA2 (1–73) vectors were previously described (Fedele et al., 2006; Pierantoni et al., 2001; Pentimalli et al., 2008).",background,neutral
74,7659,e905759f748b691668bbce13ba722cc8048f7d20>f2062face9289fddce661746aef260bb1dbb4294_4,explicit,"Minimization weights w , which results in the flatness property of the weights, is intended for reducing overfitting of the data and minimization of bad generalization effects [8].",background,neutral
75,3265,33ffc88faeb86778897beb3665e52d1b2dfbca22>0eafbc4e1efb9aa8973cc061d3b9a6924ac6cce9_1,explicit,"Because of the inherent lack of scalability in floodbased schemes, researchers have looked at several hierarchical and structured approaches [12][11].",background,neutral
76,6415,f6a206f096a50204e2e0a0c34814093a33f11a9a>7cb18539de84bbaf04bea4ac2cbb4594f293818d_11,properNoun,"The health word was seen as problematic when implementing an HiAP approach because it could hinder an understanding of public health as a cross-sectional responsibility, mainly outside the health sector.",method,negative
77,6357,c49ef960d4abc1e03b2b36dbc42f44e3c001ce46>4400c5c46b12fd9f5de1d05d0d4e79d7f820f536_7,explicit,"…around the soccer field (outside the touch and goal lines, which were extensions of the halfway line or penalty area approximately 3–30 m from each line) because multiple perpendicular views were recommended to obtain more accurate results using the MBIM technique (Krosshaug and Bahr, 2005).",method,neutral
78,1292,c4be615a53b2d1b6484f6b7888c7bcf822ab5066>80d9ec6d56799e96bf5e3e99ff0f904892820308_2,explicit,"Recent studies have clarified that such mycoheterotrophic gametophytes are associated with a particular AM fungal group (Winther and Friedman 2007, 2008, 2009), but knowledge about mycorrhizal associations of aboveground photosynthetic gametophytes is still unclear for most pteridophyte families.",background,positive
79,3895,62ece0d7a09cdfc204402e7749e4a384e05073e1>0d48a25e8b889ecded4ccfcda79fa7e5aaf697fd_0,acronym,"Ventilatory parameters were monitored with a CO2SMO Plus monitoring system (Novametrix Medical Systems, Wallingford, CT, USA).",method,neutral
80,7717,5a310d2892ef475127d54004ec1b7d79ff3352fa>3b6f481c9c76bc8b38f7b056d16b801aad9ab96f_0,explicit,"For example, one splice variant results in lIMnebulette, also called lasp-2 (Katoh and Katoh 2003). the MB-associated NEBL snP rs11012461 is located within intron 3 of the Lasp-2 portion of NEBL.",background,neutral
81,5264,c372d01f41c9af19d34cc8ad3745593740fb51d4>c428493c4e5af25f2c04bc5d139e4500352cbf7a_0,explicit,"Since starvation is thought to be one of the main dormancyinducing stresses encountered by Mtb inside the granuloma [11,33], Mtb WT and Dfcr mutants were starved in PBS to determine the role of the fcr genes in wax synthesis under this dormancy-inducing stress.",method,neutral
82,6441,41e9bd6b3e9dd39845705c0d8338c3d13ddcf917>bfa8970f6292b80844289788eb8cf87caf4b6b7e_0,explicit,"developing melanoma is greater in males than in females over the age of 40, although the opposite effect is observed in patients under 40 years old (Lens and Dawes, 2004; Jemal et al., 2010).",background,neutral
83,4842,d937bc4d0722d5b45366b3c4dfde4732224bc048>9200a75534f44836ca7651c9d63d11b884947fa6_1,explicit,"nigriventer venom, and is characterized by the inhibition of L-Glutamate receptors and their insecticidal activities [19].",background,neutral
84,5379,c59ddc8188018f5a7ae68ec962f695689f527a39>None_0,explicit,"This confirms and extends the results of Connelly et al. (2005) and the work of Berninger (1999), among others.",result,positive
85,5210,db88b652c31438045a3c781cc1cdf032efe857e5>9128005934a59b506fb1b028187865924451607a_1,explicit,"We also hypothesized that ongoing selection for seed size will have resulted in a narrowing of seed size variation among populations within bioregions and among individual plants within populations in the most arid and unfavourable environments relative to populations from a more favourable core habitat [29,30].",background,neutral
86,3940,f781c198aa27cadfaeb6537e454dbb507ccc776d>1682be6f1a8359b4657819b4806cfdeda33b64eb_0,explicit,"For source coding and rate-distortion coding problems, polar codes have been shown to be competitive with the state-of-the-art methods [2], [3].",background,positive
87,5828,ec960219d5879406ceff96099bceee4a0f3a1912>a74f9d9109cfab3efe4abae57cda36af58aa21e1_0,explicit,"Similar results have been reported by others (Tassou et al., 1995; Del Campo et al., 2000; Skandamis and Nychas, 2000).",result,positive
88,4463,15ac5bcd9ca900dc948e969558670084e3d560e0>5297cce880dad7881b5f4c16b683f971363f009a_8,explicit,"To date, most of genes involving in HM uptake, transport, sequestration, and detoxification in woody plants were restricted to Populus (Marmiroli et al., 2011; Luo et al., 2016).",background,neutral
89,7672,caabad5f9f9abd5bb9283ba9d522edbc9608f667>95bcb5593a8916440df60caf5730640d766046d6_1,explicit,"Surface air temperature data for summer (SSAT) and winter (WSAT), to the nearest 0.1 °C, was collected using the WorldClim database (Hijmans et al., 2005) at every degree of latitude.",method,neutral
90,4407,849c3f1c3b687ccca747a4f5c4eeb72fce490ddb>7cf269c7a1086fec53f4ace95010a6b6e4106616_7,explicit,"synthase (PaKCS6) (Khadivi-Khub 2015; Balbontı́n et al. 2014, 2013; Kasai et al. 2008; Huang et al. 2006; Lu et al. 2006; Wang et al. 2006; Moctezuma et al. 2003; Schuch et al. 1991; Peet 1992; Cuartero et al. 1981) have also been identified to be closely associated with fruit cracking, which also shows the importance of the fruit pericarp in cracking.",background,positive
91,6594,a987290394cf4476ea4f55f3f7bb427ff5cebf34>0c610357d8682ecc3239863bf0ccf9c8d9090381_13,explicit,"The highest deposition of Fe in soil could be due to its long-term use in the production of machine tools, paints, pigments and alloying in various industries of the study area that may contaminate soil (Yadav et al. 2013).",background,neutral
92,8001,d8a0715ca3e004b4e92f4ebf02ef39c45106ec50>15d47a35e929ec108f47d8dcfd07b2de0c064b10_1,explicit,", 2002) and hydroxypropyl methylcellulose (HPMC) (Kushida and Gotoda, 2013; Miyazaki et al., 2011) or enteric polymers such as hydroxypropyl methylcellulose phthalate (HPMCP) (Miyazaki et al.",background,neutral
93,3743,592415513225f197fa3f1297976db0c2aa1eaf8d>7db0d52a5ca00318402fb6742e940d6cce287a17_0,explicit,"The results obtained in our study agree with previous clinical observations that have failed to detect a link between administration of exogenous glutamate and clinical neurological injury in association with cardiac surgery.(11,12) The results also argue against a role for exogenous glutamate in the evolution of subclinical neurological injury.",result,positive
94,4155,b4579f102e11e42213c9d6255a83b95106f933e6>854c95b8ec92659f66945664859db55f1c8b566c_1,explicit,Anticancer activities of antioxidants are investigated thoroughly revealing the most common mechanism of action as the fenton reaction in which antioxidants at higher concentrations act as oxidants to induce apoptotic cell death in cancer cells (Matés and Sánchez-Jiménez 2000).,background,positive
95,2915,c762e198b0239313ee50476021b1939390c4ef9d>1976c9eeccc7115d18a04f1e7fb5145db6b96002_6,explicit,"The data sets we use are publicly available from two widely used knowledge graphs, WordNet [37] and Freebase [3].",method,neutral
96,75,0d16e1ff081f170337e530014df950ac5a5e83c8>f050627e5d20b53029f1d9fd334276ead4162e53_0,explicit,"Our results were consistent with the findings in the literature that visual impairment is common among patients in rehabilitation facilities (Cox et al., 2005; Grue et al., 2009; Lieberman et al., 2004; Lotery et al., 2000; Park et al., 2005; Squirrell et al., 2005; Wainapel et al., 1989).",result,positive
97,2356,d5be0ee66c527b78a82e87b0a1ad23459f717fc5>fa0627b09f5646b56da0ef8abef6ff0a421c2f4d_7,properNoun,"In brief, a stratified sample of 40,523 addresses was selected from the smalluser postcode address file for Britain, by use of a multistage probability cluster design, with oversampling in greater London [11].",method,neutral
98,7071,cf82d977a64226a15cca9fc0eea7de1e0078ce29>efe167e81022b9fb2b41ea7de996515c26f94838_9,explicit,"It is common for individual Streptomyces strains to have the capacity to both produce and resist inhibition by many antibiotic compounds (Challis and Hopwood, 2003; Davelos et al., 2004a; D’Costa et al., 2006).",background,neutral
0,108,44b5a8fde9f6c45652d642ac9d27ecb12d755ce7>a790aabb1b75ce456b0d6e7f9a79a48df554b398_1,properNoun,"Among possible explanations is the contribution of sex hormones in the modulation of Tregs.34\nTreg-mediated local immune evasion underpins the second finding of our study, i.e. the positive association between higher FOXP3-positive T cells and the presence of VELIPI.",result,neutral
1,3287,0e4bf03c0e7a18078edc742edf2f356c8b29aace>ddd33219d28357cc57f461c1ff4eed4b99e29416_0,explicit,"The 21 RCTs [15-35] and 42 observational studies [36-77] (33 cohort, nine case-control) were included in the analysis.",background,neutral
2,8116,2f82dfa009bbf2a400908101438bf9a18a87a166>f3e018cc26e36b4af92789494dbe02721f6b9ce9_0,explicit,"The change in the apparent diameter of the particles was calculated using equation (1), where di is the diameter of the protein-coated particles and ds is the apparent diameter of the sample after immunogold-labelling:",method,neutral
3,77,27db8d3a2c85cbc34deef51ce4cd850b431b4b34>a81b383bf01b572d28e1566650d938a6fe414e57_5,explicit,"The potential for BCL-xL to modulate other channels in the outer mitochondrial membrane is suggested by the finding that BCL-xL regulates the open state of the mitochondrial voltage-dependent anion channel (VDAC) in synthetic membranes (Degterev et al., 2001; Vander Heiden et al., 2001).",background,neutral
4,2976,b14d9802f95d696cb7f976988cf874e8f1273749>a4cb5a9cf95f98553274f618c6583e8d1b391702_0,explicit,"Antidepressant-like effects were measured using the tail suspension test (TST) [20], with minor alterations [14].",method,neutral
5,1148,b8bffa786710b52c95201796bade07fc2ad3f38d>0049b630e0bf4b14e76e36615c33aed0c39c3dd9_2,explicit,"Both problems can be solved in polynomial time for strongly chordal graphs [6], comparability graphs [4] and Helly circular-arc graphs [7,11].",background,neutral
6,8141,d21ed6a2508cd5081910f966da8ffbf8a601436b>51523a9c19398e4ee1aaed797506b4b14244b510_0,explicit,"In addition, both sustained and selective attention were measured with the Continuous Performance Task (CPT) [21].",method,neutral
7,2147,bd8d902558bfa6f3f676974381700a98abff3dc6>321c03aa26a2d121863a96a5b88f4a443c53a500_0,explicit,"These results support the previous study in the M. fascicularis (Ruiz-Herrera et al., 2002a), where 51.14% of chromosome bands where ITSs are located express aphidicolin-induced fragile sites.",result,positive
8,4619,dbfdbba44c6c2e8a9a2f40f3ba13efc440d56e14>368f3dea4f12c77dfc9b7203f3ab2b9efaecb635_0,explicit,"Training: We built separate directed word alignments for English→Arabic and for Arabic→English using IBM model 4 [19], and symmetrized them using grow-diag-final-and heuristic [20].",method,neutral
9,6935,9462acef826a6b495fe8fb281660ee4418bb840e>21aaceb3fc27e8cc831e25191d967daa0d8962bf_17,explicit,"A poor performance on the FCSRT has also shown a high correlation with atrophy in the medial temporal lobe (Sánchez-Benavides et al., 2010; Sarazin et al., 2010) and was significantly associated with cerebrospinal fluid (CSF) AD-biomarkers (Wagner et al., 2012), increasing the validity of this…",background,neutral
10,2996,9fe8c13205649922f73b6e784784995c3fac0ce0>465ee1982bfab0a313092fcfafdc73d23df76456_2,acronym,"To further confirm the EMu analysis, we also analyzed the same set of tumors with NMF [16,17] and found nearly identical signatures (cosine similarity 0.9988 between the EMu and NMF AA signatures) and similar estimates of the AA signature’s contributions for these tumors (Figures S8 to S10 in Additional file 1).",result,positive
11,5888,c24645826ecf07e7a064bb606157168f9ef792e2>ba480ce512aba288b1f259d2e4b1340915f4e541_8,explicit,"In view that PFD changes mouse liver glutathione S-transferase (mGST), glyceraldehyde-3-phosphate dehydrogenase, carbonic anhydrase III and Zn superoxide dismutase (CuZn-SOD) contents [42, 47, 48], we wished to explore whether it affects other cellular antioxidative enzymes.",background,neutral
12,2048,638fafc27d5b0d7c5cd719bd3ba51bec9db4bb5c>35c1ae44da7ca399aaeb11e6c80fc371f8c8aa92_2,explicit,"Patient related factors Arrhythmia / Atrial fibrillation [5, 9, 16, 20, 21, 28, 34, 35]",background,neutral
13,5768,b039291c4b41c6c735b7e443cedf89e9f6cac95e>d7a4025a169b089ce180cfce339762a52db6d254_8,explicit,"We undertook the present study because recent availability of new fibroblast markers has reduced the difficulty in addressing this issue (7, 8).",background,positive
14,5808,e1e288b90043ef702b7a409a9139a7bcc89b5043>e16c0a9c55ed7fd3bc7e4fbe1408fa4034ad3c51_1,explicit,"Electron Microscopy and Immunolabeling\nArabidopsis embryos and root tips and tobacco BY2 cells were highpressure frozen/freeze-substituted for electron microscopy analysis as described previously (Otegui et al., 2002).",method,positive
15,7157,bec86d4a4158b2e8d0ba7def7a84f30d46dce28d>None_0,explicit,"[6] and Albal et al. [9, lo] found no influence of the pressure on the volumetric liquid-phase mass transfer coefficient and on the interfacial area, while Sridhar and Potter [ 11, 121 report an increase in the interfacial area of as much as 75% for a pressure increase from 0.1 to 1.1 MPa. The contradictory results of the above-mentioned authors can lead to considerable miscalculations, whatever correlation is taken. In this paper all major studies on the influence of pressure on mass transfer phenomena in gas-liquid systems and reactors are reviewed critically. Points of agreement and conflict are indicated and discussed in order to improve understanding of the mass transfer 0255-2701/89/%3.50 Chem. Eng. Process., 25 (1989) M-98 0 Elsevier Sequoia/Printed in The Netherlands",result,negative
16,1260,3874a1098d1e34b107a9c4ba1a1e200070de15b0>7d253f083d75e9cba4af91751451b379fb5c37a3_1,explicit,"Although PPH is one of the most important types of autonomic failure in patients with PD (Jansen and Lipsitz 1995; Loew et al. 1995; Umehara et al. 2014) and related disorders (Hakusui et al. 1991; Hirayama et al. 1993; Mathias 1991), its predictors remain unclear.",background,neutral
17,1839,b355316ca8197745026ed37301f87b48049246c0>3e131089923c0ad5d22a00c1619b8a46fe3854c9_8,acronym,"Despite a study performed by Cancer and Leukemia Group B (CALGB) did not demonstrate superior activities by higher doses of CrEL-based paclitaxel [18], data from several other phase II studies in MBC suggest a dose-response relationship.",result,negative
18,1191,7ac67ff0f59585ad3b31d22424c2cef72e20a27d>8d588720ea1b676f8b3906b696e06cf64f5b766b_19,explicit,"A previously described computerized force-sensitive system was used to quantify gait cycle timing, specifically the swing time and the stride-to-stride variability of swing time (Yogev et al. 2005; Bazner et al. 2000; Frenkel-Toledo et al. 2005).",method,positive
19,4490,5bd3da496a49bdf01dd9f492ee76a7d90caf4c4d>d459f0f781a7ae7ca9e3afe0d7b62f9a2a6f6ec2_2,explicit,"In order to determine the coding potential of each MuLVERV isolate, the ORFs for gag, pol and env polypeptides were compared to the MuLV references (Supplementary Table S2) (Shinnick et al., 1981; Urisman et al., 2006).",result,neutral
20,2387,fdf8e61876d6db8df40d8a809a6c8ec6e9f9541a>87feadcddffff7ef6a3f0cc4d48bd33fb05758da_0,explicit,"…logistic regression analyses, and those factors had previously been found to be associated with children vaccination coverage in the United States (Luman et al., 2004; Santibanez et al., 2006; Zhao and Luman, 2010): children race/ethnicity (non-Hispanic white only, non-Hispanic black only,…",background,neutral
21,5701,5f94a64d4d62b3df1a5cc9e9a9cc7877fd41ac07>678e84713fdd4677117b339aa36b466b9a877614_1,explicit,"6 See for example studies of Morocco by Haddad and Harrison (1993); Venezuela by Aitken and Harrison (1999); Bulgaria and Romania by Konings (2000); Russia by Yudaeva et al. (2003); the Czech Republic by Kosova (2004); and China by Abraham, Konings and Slootmaekers (2006).",background,positive
22,3588,d44e670d26631ae2ff9e79f10a77e473f55ae2a2>0c6bd2227cbb2c90f19a98b2a00f140e0c299d34_1,explicit,"has shown distractor suppression to have a much larger effect on capacity than target selection processes (Bettencourt & Somers, 2009; Pylyshyn, 2006; Vogel et al., 2005; Zanto & Gazzaley, 2009), and as the effect on capacity of increasing the number of distractors is correlated between VSTM and MOT tasks, we believe that the resources consumed by",background,neutral
23,4056,4a44a5659034938bbffc77273c35a2117d140e21>62ab272a23272232456cf68ac8c06064f945d5ef_0,explicit,"In our previous study of slow regular saccades, we demonstrated the invariance of saccadic latencies with target angular displacement (Darrien et al., 2001) but had diYculty in reconciling the results with those of previous studies which showed an increase in latency (Fuller, 1996; Kalesnykas &…",result,negative
24,3167,1841abd0ed41a73f722a92a3a6a0f64ff08cf60b>0b52f45e6bb3a1d6c4dad07bdb343fd467fe4b46_8,explicit,clutches of eggs and continues as crabs cycle through successive clutches (Hench et al. 2004; Forward et al. 2005).,background,neutral
25,8224,9efcca9d438f63691320ff3b76310792b2784e1d>b581df1506556227e81e469e4920b0524e59d5d0_0,explicit,The C. elegans slow killing assay was conducted as described by Tan et al. (1999a) with minor modifications.,method,positive
26,7053,72f2fc47bc0de3c53f92f0d5abfef1e6de3933b9>c2de000d5652db156ba45ca8af4afac375ef9eeb_0,explicit,"In situ electron transport chain activity was examined in EWAT minces by measuring the reduction of 2,3,5-triphenyltetrazolium chloride (TTC; Sigma), as described previously (31).",method,neutral
27,6856,9b62e34a05c360b66436de3a04a0a8543285f0e4>bc043ebb90992e6a583c3071266b163376a27067_1,explicit,"…inactivation (Charlton et al., 1982; Chaudhuri et al., 2005; Forsythe et al., 1998; Xu and Wu, 2005) and vesicle depletion (Custer et al., 2006; Pieribone et al., 1995; Schneggenburger et al., 2002; Xu and Wu, 2005) have varying dependence on the frequency of stimulation at different synapses,…",background,neutral
