,Unnamed: 0,citingPaperID,source,string,label,sentiment
0,2305,f6e7d88342d23cdc6dc959b16106b6bb05fa807a>0fee7f15bb7d5813de71b2951c5d118fbcdd4832_0,explicit,"Utilizing gain-offunction assays, we demonstrate that enhancing actin polymer-\nthese proteins does not increase SV density (Scheiffele et al., 2000; Bamji et al., 2003; Sara et al., 2005; Latefi et al., 2009; Linhoff et al., 2009).",method,positive
1,3210,51439b498621806aa3a915fdbd4aa983473da397>6eb725dc2d318750265f1c8e64ee12c4b286a796_1,explicit,"maticity, refractoriness and conduction of the heart are conserved between zebrafish and humans [44, 46].",background,neutral
2,4484,64cf98067d1cadda174e5ffa24fc45a6b3e6426f>2d04ac3be66a1148b0e0aeb687d0345841ca674f_0,explicit,"For reovirus 1/L-induced ARDS, at day 9 postinoculation, there is a severe pneumonia (peribronchiolar lesions with lymphocytic infiltration) with the presence of hyaline membranes, which are pathognomonic for human ARDS (20, 21).",background,neutral
3,5821,9b6d433ab5104713ee41fbeb24b4d0f2b82fe587>9515894ed25dbdf24e8187e166a6e9bcb7cce1c1_1,explicit,"Besides that, no ameliorate impacts have been obtained on the use of antioxidants in some studies (12,13).",background,negative
4,3514,15ac5bcd9ca900dc948e969558670084e3d560e0>5297cce880dad7881b5f4c16b683f971363f009a_4,explicit,"However, limited information is available about molecular mechanisms of HM tolerance and detoxification in trees, and most of HM related genes in woody plants are restricted to Populus (Luo et al., 2016).",background,negative
5,627,8c6cce1fbc57de411affb7d09fe11b1d2c6e5861>eac9c263d99f397dfc2518ac55f610130aac32a7_0,explicit,"A recent qualitative study explored the views of individuals living with SCI towards the descriptive systems of six established instruments (15D, AQoL 8-dimension questionnaire (AQoL-8D) [28], EQ5D-5L [29], HUI, QWB-SA [30] and the SF-36v2 [31]) [32].",background,neutral
6,536,d589dbea5c3743b8b8b8857d2f729e0fefff6790>f852f6d52948cc94f04225b8268f09a543727684_5,explicit,"In\naddition, there are continued new developments in lowcost, light-weight, and long-duration UAVs (Lucieer et al. 2014).",background,positive
7,2414,96e4832d62cfde2cc818aa932b298dd9ea3c2e3c>3c72a28a95fbca56237572416af8ecf1612b0fcf_2,explicit,"These results are consistent with our previous in vitro finding that Sef loss can enhance FGF-mediated induction of MMP9 in prostate cancer cells, which facilitates tumour cell invasion and migration [20].",result,positive
8,644,5ddd341c20f323d736e9b3899ad20561c9bdbeea>8f2cfced117e54b3e1ba97b0e43f34e0ec747952_2,explicit,"Typically however, when a fungus was isolated from a seed, it was the only isolate, and roughly 74% seeds were free of all culturable fungi (Shipunov et al., 2008).",background,neutral
9,7534,a69bb3e0deb2b7140547f114381ccac97a81fd16>878bcdda5eaa502eb6834d9366c9bf5746a1072a_1,explicit,"Subsequently, Shirure et al have shown that MAC-2BP carrying sLex was functionally involved in ZR-75-1 rolling on HUVECs cultured as monolayer (8).",background,positive
10,6307,2956fc184e598be3422943be2279d64ef26ec43a>7cf4a263353bc2680e6c18ef67daf382aec048a9_0,explicit,"It has been demonstrated in numerous experiments that anonymous pre-play communication increases cooperation in social dilemmas and improves bargaining efficiency (Sally, 1995; Camerer, 2003; Valley et al., 2002; Ellingsen and Johannesson, 2004).",background,positive
11,6389,e3f3c1e9eb72a18e7cd93ff3a26395db9c6b17bf>0d9d447667b6ceda0ae4c4f05315da49479546a5_0,explicit,"Eicosanoids derived from AA, including PGE2, TBX2, and LTB4, are more proinflammatory than those derived from DHA (Calder, 2006). The results of our study confirmed this pathway of eicosanoid formation. Chickens fed LR diets had significantly lower levels of PGE2 and TBX2 in the blood than those fed HR diets. These results are in agreement with those of Cherian et al. (2009), who showed that the level of incorporation of n-3 FA was higher, but that of AA in cardiac ventricle lipids was lower, and the levels of PGE2 and TBX2 in the blood of progeny (7-, 14-, 28- and 42-day-old chickens) were lower after feeding HR diets to broiler hens. Liu et al. (2014) reported significantly lower levels of pro-inflammatory eicosanoids (PGE2 and TBX2) in the plasma due to inhibition of phospholipase A2 activity in chickens fed diets rich in PUFA n-3 than in chickens fed diets rich in PUFA n-6.",result,positive
12,4744,60298d665f7d34f06554a62b92d7a514c5ddf35c>45e3c905eea1f903fdca2de448da90cb6ceaa0bf_0,explicit,Up to almost 70 percent of patients with NS-associated FSGS may attain complete or partial remission and maintain stable renal function for about 10 years when given a prolonged therapy with steroid or immunosuppressive drugs (19).,background,positive
13,6533,f308573f2763a4fccddef893ec91c88892bf2708>99066822ef1abdc6368bbf1435380f1a2048a352_0,explicit,"As the ALSOVA study did not use a validated instrument to rate pain, somatic symptoms (symptoms of discomfort) were evaluated for their association with analgesic use, and assessed with one screening question ‘discomfort and symptoms’ from the 15D self-administered, validated, health-related QoL questionnaire [31].",method,negative
14,4719,5a0d2bbf421fadf679e5c5c0fccc5b222e05591c>2c10c18cbb2842c76d55bd5283cd21df42b6f1d3_0,explicit,The computational camera with the coded apertures is able to estimate the depth of the scene in a single image [3].,background,positive
15,1273,fbea85be172e21855cee46d6209bae3f95941ff3>17f2bd869df15476815b6d6a98d9a3184ea6c714_4,explicit,Pricing via a coherent risk measure was first introduced by Artzner et al. (1999) and it reduces to a search for the infimum3 of all risk measures over an acceptance set.,background,positive
16,4380,34d3411b4cae75f253e72cdfc5b63038f9b34a08>17aaebfb7135313cc1c01c6364542938f842da7a_4,explicit,"…further or more often to meet the energetic requirements of their members (Milton 1984; Janson 1988; Wrangham et al. 1993; Chapman et al. 1995), and previous studies on Amboseli groups have found that dry periods are associated with increased time spent foraging (Bronikowski and Altmann 1996).",background,positive
17,7861,f8aea2f05f28ca6d45924decc3886908eebe50a8>410e4b3334e9ef76ff29d49f178d23895a908501_3,explicit,"The APP response has been observed in common pig infections (Grau-Roma et al., 2009; Pomorska-Mól et al., 2011a, b) but it is not known whether infection with H1N2 swine influenza virus (SIV) also induces an APP response.",background,negative
18,1070,dc873a8811c4a7fea968ef54b772bd41476e6562>0647fe48491f82a8314453ad79912c780badddba_4,explicit,"lingual phrase-based machine translation system with a reranking post-processing step8 (Wubben et al., 2012) and Hybrid, a model which first performs sentence splitting and deletion operations over discourse representation structures and then further simplifies sentences with PBMT-R (Narayan and Gardent, 2014).",method,neutral
19,1536,112182f0d1c9d900ff54fe4c6cc05abbafa20c66>9dee797bc8d8798a48c2defb4c91efc3b8ec5fe9_1,explicit,"radiata are usually diurnal [30], [37] herbivores, whose broad diets occasionally include non-vegetative matter, such as carrion [38], [39].",background,neutral
20,7935,7119b00e3e901c828fe67fdf97d3e0d17e5e7e8d>c3022a787a04bdea801dbc2b4bd254e9dcbf5db8_0,explicit,H1-receptor binding studies: Inhibition of agonist-induced calcium flux was measured in CHO cells expressing the H1-receptor using the method described in [24].,method,neutral
21,6559,cf627c9411e3bf3e67f23df5d5741ed48490a152>3d2c9ed378b475d7b8c2497ee35c17cb4397c3b4_4,explicit,"During infection, C. neoformans cells of varying cell body size and capsule size are observed (Feldmesser et al., 2001; Okagaki et al., 2010; Zaragoza et al., 2010; Alanio et al., 2015).",background,neutral
22,3901,65041cb8022f68e5915a292159e993a4f66cc33d>8f0a503433a51abafd0f0251f3940a7a7a3319f2_0,explicit,"To further characterize isolates, random amplification of polymorphic DNA polymerase chain reaction (RAPD-PCR) was performed using an adaptation of methods described elsewhere.(10)",method,neutral
23,4119,952660f4a305ebc8bc46ea23dd1ea41464d6681f>6b1223f442606ef04c8c04b36f1cdc0efb14c560_0,explicit,"It was also observed that CP treatment increased BUN and creatinine levels (Sadzuka et al., 1992; Mansour et al., 2002).",background,positive
24,4099,1b7d342e9e8cfc8f2327c9f62f3d40b4be7e8624>00aadd931a2b4603101a355d6b18f2c2bd17a3cd_1,explicit,"In caveolae membranes isolated from total plasma membranes using the methods of OptiPrep gradient centrifugation (35, 40) (Fig.",method,neutral
25,1297,0846094df2ef424e028c4b4e8b934d1db79e6948>01a75b84837517a571fa674cef763e7b24009cbb_1,explicit,"In particular, our model results are largely consistent with a classical description of the neurophonic as a dipole field generated by postsynaptic currents in MSO neurons [3,4].",result,positive
26,7617,d1ce95485162b623ceb11701c8fc7ae2905b8be7>12d7d6767817649ebbaf818e09cdc1dd02bc6c21_0,explicit,"Overall, we confirm the results observed by Ferrero et al. (2007a) on the effect of radical surgery for endometriosis in women with moderate to severe deep dyspareunia.",result,positive
27,307,c90bd4becaf4f7ff7d7d575f735d8871a88134d1>1962ce0c3b9ad9290eb091be08c9972df5fd63ce_1,explicit,"After being presented by Jacobs and Bruscos (1995), diverse IG-based algorithms have been applied to solve various scheduling problems, including single-machine scheduling problems (Ying et al, 2009), parallel-machine scheduling problems (Lin et al, 2011), flowshop scheduling problems (Ribas et al, 2011; Pan and Ruiz, 2014), HFSPs (Ying, 2009; Ying et al, 2014), distributed flowshop scheduling problems (Lin et al, 2013b; Fernandez-Viagas and Framinan, 2015; Ribas et al, 2017), and personnel task scheduling problems (Lin and Ying, 2014).",background,positive
28,4872,13e1ae04338649fc93817536891b96c04b3011cb>e4d55ce4baa96eb4fd77a2c27de168cfedad611b_5,explicit,"If medical evaluation reveals systemic lymphoma, treatment of the ocular disease is secondary to systemic treatment (usually chemotherapy).(1-30) The effectiveness of EBRT for the treatment of lymphoma of the eye and its adnexa has been widely documented.",background,positive
29,1282,d35227b7a396b97aa82a4422f50ad9f341b9a191>b910ddbed873468c87bb5d9218b6058c308df87e_0,explicit,"…Keddy 1989; see the review by Pausas and Austin 2001 and disturbance frequency gradients Connell 1978; Lubchenco 1978; Huston 1979; Wilson and Keddy 1988 could also be applied to the time since abandonment e.g., Peet 1978 , although the underlying factors may be different in each of these cases.",background,neutral
30,3248,46865a7d91b8b6ac7360d4e6a181e29a76d0111f>7fdab2d31c2712734271c67dd3e3decdcf9f6139_10,explicit,"Although extensive research have been carried out on testing the ISSM [16–19], little study [6] exists which explores the success of ePortfolios by leveraging ISSM as a theoretical underpinning.",background,negative
31,420,ad4e0a20046326e3bb7a6514d41c38bf902aa69c>1959ef6015c3098b4bd4fa6ee8b76479fad3a390_1,explicit,"We conclude that the FSClow OX1low cells represent microglia which are smaller than macrophages and lymphocytes (Milligan et al., 1991) and have a lower OX1 expression than haematogenously derived cells (Sedgwick et al., 1991).",background,neutral
32,2706,5b36a10ab1c0b5454959edc29a00b0e6c2546974>777cb6d460aba93eda5d7bf2e6f01c5bf9666171_2,explicit,The higher value for NST than GST would be indicative of a phylogeographic structure (Pons and Petit 1996  Petit et al. 2005).,background,neutral
33,6608,84c876e22b451d542f33a0638b03556cd3e1791c>1835df49afef4f71cafb7b8966e91ee9e13a6ed9_0,explicit,"The literature (Sugihara and Smith, 1997; Shahidi et al., 2004; Gerke, 1999; Gao and Tian, 2007; Zhao and Yan, 2005) shows most of the non-traditional algorithms are applied only for regular convex polygonal obstacles, not for irregular convex, concave polygonal or curved obstacles.",background,negative
34,1684,cf43ab7995bb90d374fddcf917685ae5c757c13f>c0e9eaec2955cf840c040baae65c4a25f1f6f126_5,explicit,"After the slow phase of cellularization, the network shifts into a fast phase of rapid furrow ingression and membrane addition is targeted to an apicolateral location (Lecuit and Wieschaus, 2000).",background,neutral
35,2597,1dda7170349d2f68f769fdc70f166c17f586d92e>bd018232480d8e2979b40ad583b69fb449d86ddf_0,properNoun,The D-HOTM system is based on the Text Mining Infrast ucture (TMI) developed by the parallel and distributed text mining lab at Lehigh University [20].,method,neutral
36,3112,340300238e998780678ad5f97c8e1807be13766d>560e28cb2e297629602a33fd6358703dfc8711a3_1,explicit,"These results are supported by previous published data highlighting that the miR-34 family, including miR-34a and miR-34b/c, acts as a tumor suppressor, able to inhibit different human tumor growth and invasion [36–39], including human LSCC [31–34].",result,positive
37,5640,10f96909af3063b0b91c49a7026f740bbf2faac7>05b2caf96bc3917d5194908b0b71451831f2f7f9_0,explicit,"This effect is virtually identical to what was reported for cells treated with cyclodextrin (Pontier et al., 2008; Allen et al., 2009).",result,positive
38,6034,4552697d8f6a250de747b259809c1b53bd6a86f4>2f587ec3f121d1121885a4a62d2a4a82422c14be_3,explicit,"bacterial species can drive major changes in the gut microbiota and, thus, influence the metabolic profile (Marcobal et al., 2013).",background,neutral
39,6448,af56649cc22778ec10d8618aa4af8ebd6e38f0a0>557cc8ec2b74415ab53bb36e4aaea3a594a40390_0,explicit,"We have sampled their data with 4 different methods: the insertion sorting algorithm (IS) and 2 variations of it and the binary tree method [7, 3].",method,neutral
40,3522,0160b539a82e5f6206bb6b8601ffc226c2e549e1>6a68d0419f4940c81fcbcb4ce4eee5bdd5a41ce6_0,explicit,"Cell viability results showing that lung cancer cells exhibit resistance to the cytotoxicity of high concentration of ATP in comparison to normal cells are consistent with published data that showed low (nearly undetectable) expression levels of P2X7R in lung cancer cells (20, 21, 39).",result,positive
41,4496,3519a9fb317c4df1b30b5dc090cc083afab9f2b1>7f185882e50d73615d92eedecb037d2e878a3b84_4,explicit,"The absolute pose estimation of a perspective camera from n 2D–3D point correspondences is known in the literature as the Perspective n Point (PnP) problem, which has been widely studied in the last few decades [6, 13, 14, 8].",background,neutral
42,2656,75dd23a96d636660c244f0e1f0f4d8f95f5c6432>b0766708cd2a8f253df0bdefd9723b6083555e9e_0,explicit,"Taken from the revised Chinese version of the Health Literacy Management Scale, this questionnaire was designed to cover multiple items related to health literacy, which are consistent with the theoretical content of health literacy as noted in the previous literature (1,2).",method,positive
43,4557,0fd5830f851a1745de63b38ff1b9d1747b93ac02>9639fc85db8fd700c897f0e186f01a04775ef572_0,explicit,"This conclusion is consistent with previous results (7, 21, 22) that suggest that the increase in ALC produced by the b-adrenergic agonists isoproterenol and terbutaline is characterized by an increase in the proportion of the total sodium transport that is amiloride-sensitive.",result,positive
44,3407,18338cd6134f8b663574072da97cba18f3ab69e0>39dc218eb5582e861e53c8451586786cfaca08ec_3,explicit,"Over the last few years, many different local interest point detectors (like Harris3D [16], Cuboid [6], Hessian [35] or Dense sampling [33]) and many spatio-temporal descriptors (like HOG [17], HOG3D [14], HOF [17], Cuboid [6] or ESURF [35]) have been proposed.",background,neutral
45,5543,0c3173cf70ae0ef21ddd07b2feded1e8f0a9de13>4fa7c6cd134f315bac9f3153dc618c144ac7791e_3,explicit,"While beaked whales and large delphinids produce clicks with comparable energy flux source levels (Madsen et al. 2004, Zimmer et al. 2005, Au et al. 2007), they may hunt in quite different ambient noise environments.",background,neutral
46,103,a1d74b4d976fd796bfe2210fe309ac50da624dec>e534f2caa4207899af221c6804ccd4759dd1d66f_0,explicit,"Rutin (3,3′,4′,5,7-pentahydroxyflavone-3-rhamnoglucoside, Figure 2) also called sophorin, rutoside, and quercetin-3rutinoside is a polyphenolic bioflavonoid, largely extracted from natural sources such as oranges, lemons, grapes, limes, berries, and peaches [30, 31].",background,neutral
47,2943,7b0ca6f15e76f285cc19efd2305cb1ec9e16a5b5>df90f3e882609d15c298251608a5b48b69efb3b8_6,explicit,"Interest in the use of CWs for remediation of runoff from agricultural irrigation and agro-industrial production has become increasingly popular over the last decades, due to their low capital and operational cost, low energy consumption, and environmental friendliness (Huett et al., 2005; Scholz, 2007; Carty et al., 2008).",background,positive
48,2539,95c39aec660c32b4ea8aad1b70a965dfa5098268>9f1edb9cb0399a10bb9db6f3d6371fecfc2e6708_3,explicit,"PAR has been described using the image of a spiral (Williamson et al., 2004), and various authors report the suitability of the application of this method to the management of change within organizations (Coghlan and Casey, 2001; Coyer et al., 2007; Kelly and Simpson 2001).",method,positive
49,1961,9188d4db89d7031f7ca876c1677c7e61be9e5237>2b187f3b3326c4537740c5d8a08387cfc450e7df_15,explicit,"These effects of locomotion on the baseline activity of Sst interneurons confirm some previous results (Polack et al., 2013) but they appear to disagree with other measurements (Fu et al., 2014).",result,negative
0,3923,6828a9cc19290ccd8cc99ccc678a042b00d92125>26cad9596f887db0e87c493d022d871c144e42bd_0,explicit,"The relationship between DNA content and absorbance at 600 nm is linear [17], allowing the amount of DNA in each unknown sample to be determined from the standard curve.",background,positive
1,4306,5cecd1d9932d3f269b1caa45d07e84e3376c3710>9a0f537ddecebb9d82a5aa5cdf14c338358e4e02_1,explicit,"With respect to the contradicting results of other studies (Licausi et al., 2011; Weits et al., 2014), we propose that the air humidity during the recovery\nperiod is a crucial factor for the length of survival of submergence in darkness, which was shown here for treatment of the different genotypes…",result,negative
2,4960,1890ccd4d2a4d542ba24081b593ab8060e38f101>12732c384cfbe175c11e50e07ac8a752db845af1_2,explicit,"We elected to take this course because formal methods for analyzing the efficiency of move ordering strategies in the alpha-beta search are unreported in the literature [27, 30], and as a result, practical experimentation is the accepted form of analysis in the state-of-the-art [26].",method,neutral
3,6921,e2e9ce75aab15707ff3b85378b61f161c0b7886a>39688485b3149cfaa7b97d2e6eb20577b7ad1bff_2,explicit,Nuclear localization of PTOV1 is required for the stimulation of cell proliferation (Santamaria et al. 2005; Santamaria et al. 2003).,background,neutral
4,3526,afe94f58975df56a9c0450c8153c2dd43d0b597b>ec6940445a5702b8dde4e44b0f670fcde8ef2973_0,explicit,"The remaining medial portion of the bone was potted (Codsi and Iannotti, 2008, Hoenig et al., 2009, Kwon et al., 2010) in an epoxy resin cylinder (Struers A/S, Ballerup, Denmark) to obtain a secure fixation of the bone to the set up while simultaneously isolating the bone from deformations induced‚Ä¶",method,neutral
5,39,2e8e515a004bee99bb91d5344dc91e8855e3395e>0da4a90c139164532691e314425354c2a80a9578_0,explicit,"The occurrence of soft tissue tumors in such field of low-dose irradiation (LDRI) has also been emphasized by other authors [50, 52, 53] reporting the development of tumors of the skull bone and neck after exposure to full-mouth diagnostic dental X-ray film [3] and to irradiation for enlarged tonsils [54] and thymus [55].",result,positive
6,3858,7e9cfcc9b895ed9822c55a2bb9f4c77e6c1090de>3ed84f2fbdc4dc6450919ec5b017e66440a5833c_0,explicit,"We consider 100 million single (and early) simulation points as determined by SimPoint [24], [25] in all of our experiments.",method,positive
7,4208,0bdb75eb4a77f7e0eeaa0ab268d4353725fe80dc>68a821baf0d8ea6bfa004bf5e8030a236de5bf91_7,explicit,"Third, we used a meta-analysis technique to assemble the results of eligible studies, and the pooled results were presented in the format of quantitative data; whereas in the systematic review by Jiang et al, they only described the previous relevant studies and did not give a quantitative analysis for these studies.(13) Although studies comparing between ACDF and ACCF have been done, the optimal approach that provides better clinical effects in the treatment of CSM remains controversial.",method,negative
8,3417,601e3cc86fd0d0071a89cfd3173883f1c69dfb69>7889c9d6699535681ff7832fc0099477f822949a_5,explicit,Obesity is the central and causal component in metabolic syndrome and adipocytes produce a variety of biologically active molecules [9].,background,neutral
9,476,888c13b69c258e34aa7723593dec58e0d84a477c>799dff462adc8a8f5706b4d417d7db15371fde6c_0,explicit,"A private key is required in the verifier side to generate N pseudo random locations to be used for retrieving the watermark; (2) a watermark is embedded into two or more halftoning images, where the retrieval approaches can be overlays of halftone images [15] or using a look up table (LUT) to decode the watermark [12].",method,neutral
10,4157,36ceef2b34333ba5a456a98c702e1ded1416b022>f57614c52ad76dcabc48974e9613520a6fbb6627_7,acronym,"Following precipitation with 0.3MNaAc and 2× volume of ethanol, the RNA was treated with DNAseI (Sigma) and quantified in a NanoDrop 1000 Spectrophotometer.",method,neutral
11,2013,52c5fb4d49223c832f0e332c1b86478fdba9efde>3683a60ea1dc9a3b95399023fb077f70596426d1_3,explicit,"Mammalian Rap1 isoforms are perhaps best known for regulating integrinbased cell matrix adhesion (Bos, 2005; Kim et al., 2011), but Rap1 also regulates cell–cell AJs in both Drosophila and mice (Kooistra et al., 2007; Boettner and Van Aelst, 2009).",background,neutral
12,6214,5a104aa1d96209f1d2a7df96b67c8b06f8cc691c>18bc8b07747174cbac2230f69e4d66800c0424e3_2,explicit,"The Intercontinental Chemical Transport Experiment B (INTEX-B) aircraft campaign over the North Pacific and western coast of North America made measurements of OH\nand HO2 (Mao et al., 2009; Singh et al., 2009).",background,neutral
13,2268,a7ecbb4b04344102d5b60b3a02fcdab476510a1d>7ea83ac623c5c7f5f7b38b3ca5d243b74fdef823_1,explicit,"ICP-MS reports of sub-parts per billion detection limits, multielement analysis capabilities, and a wide linear dynamic range have made it an often used technique for wine elemental analysis [9].",background,positive
14,4820,fba87196a509337ebbe455d44f0c51e9c7c3f37d>3bdd0c94f8f7905e9118a73479fa2231ecdf61a6_1,explicit,"In fact, Underwood (1957) made this very point when he observed that the sleeping subjects in Jenkins and Dallenbach’s (1924) classic sleep study did not avoid learning material that was similar to the study list, so avoidance of retroactive interference could not explain why sleep facilitates…",background,positive
15,2030,bcc70610a604fb69e72d985e38b5ab1ec764f5c8>0b480e6c36a2e239bca21a0dfd56b0d83337facd_0,explicit,EPA is also shown to attenuate renal fibrosis and TGF- 1 expression in a diabetic mice model (44).,background,neutral
16,1078,5dc34bf29597dd113904a13c9ea9b31e849f3ec4>4f7cdae160ebb452ef8bb9b54877df782427709e_2,explicit,"8\nTo validate the quality of our categorization, the next section discusses series of experiments that compare the performance of the vector space categorization approach with one of the top classifiers, Naïve-Bayes (Friedman et al., 1997).",result,positive
17,370,66cff403dcc51acca22bc0d274a7cec93072f1a9>272af35fe6b99d2fc40ae23b6aef400b667fb8c5_0,explicit,"These were derived from prior non-operative studies for inguinal hernia and ventral hernia [15, 23, 28, 29].",method,positive
18,6837,fd81afdbe17a00587b2877142619dd40066f6d90>b0b5c62518d18d4f2a196e683e45f8be81dbb56c_0,explicit,"Gouveia and Martins [7] reviewed exact and lower bounding schemes, including earlier works of Gavish [4, 5], the branch-and-bound algorithm of Malik and Yu [10], the Lagrangean relaxation approach of Gouveia [6], and the cutting plane method of Hall [9].",background,positive
19,4686,794435fe025ac480dbdb6218866e1d30d5a786c8>b7a6c292f33ff9875a9b6419689575751c9a81ce_3,explicit,"…2010)\nLack of HPWS/HRM in Victorian health care organisations\nVictorian state public health care organisations report limited HRM/HPWS components (Leggat et al., 2008) Victorian state public hospitals report fewer aspects of HPWS then community health services (Leggat et al., 2006) CEOs, HR…",background,negative
20,2392,a0a582bb41b2bf554d16b5f6cbc5a52c14d97f34>9d6908c9357884f10f8c029b40955211db6a274f_0,explicit,"Neurotrophins have been proposed to play a role in neuronal survival, proliferation, maturation, and outgrowth during development, and to show neuroprotective functions after brain injury (3, 4).",background,neutral
21,8213,d5e9bb418f5183ebcaf371efce583b2e710315ef>6aa6183f41837ccaed16951fe32e9e3e861a0356_1,explicit,Gadolinium enhancement of the inflamed tissues is usually present with MRI.(15) The present case varied slightly in that the foreign body was isointense to hyperintense on precontrast T1-weighted images with the surrounding inflammatory reaction also being hyperintense to muscle.,background,neutral
22,1959,59f5eeff946b1900d58c2bcac3c6a03debed57b4>959292315904c3af70497ef8bdbfeeaf53efe724_0,explicit,Northern blotting\n The ORF sequence for HvNAS1 (AB010086) was used to create an HvNAS1 probe (Suzuki et al. 2006).,method,neutral
