,Unnamed: 0,citingPaperID,source,string,label,sentiment
23,1124,a38b631c1c6bf34af69e04ff2bdc79b856ad8c4f>3ac795339bd00acc0c2a8d2794129a09eae53fe5_0,explicit,"Findings of difficulties in locating the presented tactile stimuli, which were space- and not arm-based [32], and difficulties in deciding on the exact position and orientation of the limb or on the laterality of pictured hands in limb laterality recognition tests [29,42,48], are reminiscent of patients with poststroke",background,neutral
24,6043,116d5240ef90260ff66cf6b6182bcbb20b91ad28>eab6176788b00d2273c348bdda11b40c7bf6d4f7_0,explicit,"An interdisciplinary approach has been advocated for in a broad range of healthcare fields, including primary care [1, 2], developmental disability assessment [3], com-",background,positive
25,5599,27717c955391418fdfd741398938409a32848c93>f2d1e364a067e08a35265de3c56c9dd5e8595d18_4,explicit,"This i Attribution License (http://creativecommons.or in any medium, provided the original work is p\nthe formation and evolution of meteorite parent bodies (Ebihara et al. 2011; Nagao et al. 2011; Nakamura et al. 2011; Noguchi et al. 2011; Tsuchiyama et al. 2011; Yurimoto et al. 2011).",background,positive
26,2266,599de37e6628fd9e2f42eff08de73e85fc9e3e10>d55c95cedf9904a2776b682518c24b4d4d96bec7_11,explicit,"represent phases in a progressive deformation, with layer thickness as the evolving parameter [Ghent and Hansen, 1999].",background,neutral
27,952,845cf76f206f77c1e415478ac1ffa6a9a7012f65>4a19358ae23379109c673275161644ca1ea760ac_3,explicit,"[30] focus on returning the fragments rooted at SLCA nodes, and propose an XML keyword search engine XSeek.",background,neutral
28,2295,45b494f982aa56b15771b334ec617d684008665d>f76b021b2e67dc2482230be64f5a8869835a2b78_0,explicit,"The ethanol was gradually introduced into the diet over an 8-day period, as described previously (22, 24).",method,neutral
29,2215,43b02723a14f38cf3060af20b7d6d576563380c8>55899ffa1ca17fd8ba86a6298a245723ddb22038_2,explicit,com) was used to digitally capture the referent and simulation data from [17].,method,neutral
30,3498,a8f49b3a14ffd36050a4ab74b70097f4bdb456b2>bf20bd31aa1cb7f16bf072987a797cef964f56c5_0,explicit,Frequent methylation for TIMP3 (Kang et al. 2006) and CDH13 (Suehiro et al. 2008) in the present study concurs with previously published results in endometrial cancer.,result,positive
31,947,cc422e84e4eb54117601e49159e666a3fddffbf8>7e48b69cdf8cf5d02fe1998e206523d85e21130e_1,explicit,"This dysbiosis may impact the presence of interleukin-17 (IL17)-producing T-helper cells (Th17) and regulatory T cells (Tregs), as the development of these cells is heavily reliant on the microbial composition (Atarashi et al. 2011; Ivanov et al. 2009; Kriegel et al. 2011).",background,neutral
32,1547,25b442e8fcc52b495b776f208a1904e854c239e8>7ef70c0f59587e8183581c34e32991d8b3b3d77b_1,explicit,"ported lower levels in cases (15, 16, 19, 22); four reported higher levels in cases than in controls (18, 20, 23, 27); and one reported equal levels in cases and controls (17).",background,neutral
33,2116,9dc7e80e06268422d843f7c51c189e5ce6ceb568>4d7306d6200d68d8b18a331837efef26ef5e034c_2,explicit,"delayed in monoamine oxidase A-deficient (Tg8) neonatal mice that display high 5-HT levels in the CNS (Cazalets et al., 2000).",background,neutral
34,8225,15ac5bcd9ca900dc948e969558670084e3d560e0>5297cce880dad7881b5f4c16b683f971363f009a_2,explicit,"Concerning the adaptation to HMs in plants, woody plants and herbaceous may possess similar physiological and molecular mechanisms underlying HM uptake, transport, sequestration, and detoxification (Luo et al., 2016).",background,neutral
35,516,8c241dbf1fe7a1363a7fdd859837163c14d797e6>008a72dd05abca0751c45575889c98395e77ccf3_1,acronym,The importance of reliable M-shell Fe DR data has also been shown by the analyses of recent Chandra and XMM AGN spectra.,method,positive
36,2368,a7ecbb4b04344102d5b60b3a02fcdab476510a1d>7ea83ac623c5c7f5f7b38b3ca5d243b74fdef823_2,explicit,"Several sample preparation methods have been employed for the elemental analysis of wines, including direct dilution by factors ranging from one to 10, UV-assisted digestion, and open or closed vessel acid digestion assisted by microwave radiation [4,6–12].",method,neutral
37,2377,c8a6684fd1e2c6305040b1f9847c8e5624929cb8>b9a41ab6cc7c80fe33e775f44fd86a6ebdf1e564_0,explicit,"Although it forms the largest ethnic minority group in the UK, the Asian community is not a culturally homogeneous group, a fact that has not been addressed in previous studies of childhood cancer in Asians (Stiller et al., 1991; Powell et al., 1994).",background,negative
38,8020,b45e9c37ce7d2264d52fad7714f537c8bb4c2ee2>daf7dea2d63b94db589a516c297f9867ff1d26f7_2,explicit,"The epidemic curves in the Montreal network occasionally exhibit multiple peaks, driven by underlying community structure [56].",background,neutral
39,6631,9ae9e2cada91b886ecb890bdbee0e7a7a8f8dd87>b5fdec691027cb589bac14adfe45a2a95b900ef1_8,explicit,"Furthermore, tumor-associated macrophages secrete products, such as TGF- and IL-10 that suppress anti-tumor immune responses [14, 20, 10].",background,neutral
40,7569,2f26d5337ff6c0f1c54aef400829430dbd7b5324>beeb207b9e8ca62f653569081348761c4b388fc4_0,explicit,"This model has been improved by means of techniques and instruments of data acquisition: particularly, through the development of statistical packages applied to the different factors as well as through GIS softwares, used for the management and processing of georeferenced data for large areas (Johnston, 1998; Meijerink et al., 2003; Daniels, 2003).",method,positive
41,3742,30e507c0ba9bdbed320d311bebe5b875c24ef38e>d7303e7fc223a95be34287f53dca238c43548fac_0,explicit,"Differences between central (aortic) and brachial BP could be clinically important, as central BP is more closely correlated with target organ damage in hypertension [4]; is differentially influenced by antihypertensive therapy compared with brachial BP [5]; and may be a superior predictor of cardiovascular events than brachial BP [6].",background,neutral
42,7029,e57e58569dcede6b8af27bc468f06a249371ea75>38211dc39e41273c0007889202c69f841e02248a_1,explicit,"In this section, we first present experimental results on CIFAR-10 [20] and ImageNet dataset [5] to justify that pattern binarization could reduce the effective number of parameters dramatically and fine-tuning other parameters of the binarized network with fixed binarized pattern could achieve comparable performance to that of the original neural network models.",result,positive
43,609,72db776932b5aa4889eb68f84ac5cdc1138429a2>7fc86bb2e1efa0eae319ba9aa25698edfcf16328_2,explicit,"Approximately 1/3 of the glucan in DGS is starch, indicating the need for amylase as well as cellulase (Kim et al., 2008a).",background,neutral
44,3213,1b5291e439d1c04e9382ea9ee867c361e15c9568>478a1e8d54f0c50fc137cdc5d0d07c599771aa29_0,explicit,"Integrate the spectral and spatial information with the time component provides rich information to detail the space variations along the time [Petitjean et al., 2012] and can provide pattern observations, which are not found in single time observations, such as trends and periodicities [Kuenzer…",background,negative
45,4692,10a87c298478ef8c494bd697180831e443c3a476>f99dc683954a95d372875a4bf7d5f3e74b3942da_0,explicit,A recent review by Kazan et al depicted current advancements in FHB pathogenomics and host resistance [26].,method,positive
46,3046,3611fa9de1d9cd97a8dd2b576c6faa036900b859>8691886bd05201c4736e10f564525f8cd4f60b2e_2,explicit,"…is variation among ecosystems, the most common eVect of exposing plants to UV-B is a decrease in the intensity of insect herbivory (Ballaré et al. 1996; Rousseaux et al. 1998, 2004; Mazza et al. 1999b; Zavala et al. 2001; for reviews, see Ballaré et al. 2001; Caldwell et al. 2003; Bassman 2004).",background,positive
47,8058,c89c24eeb1d89b053434636c27d263c19bd3f3d1>705be404cc29f8bc30fbfc45f5ff79657a037b90_0,explicit,"Thirdly, ErbB-3 is characterized by a defective mechanism of clearance from the cell surface (Baulida et al., 1996; Pinkas-Kramarski et al., 1996): instead of ligand-induced internalization and degradation in lysosomes, a mechanism shared by many growth factor receptors (Sorkin and Waters, 1993), ErbB-3 is destined primarily to enter the recycling pathway (Waterman et al.",background,neutral
48,5755,f5206cef831a3ed9b37456924fe7f1a75d679823>7eeb22340e8c799c2b4d186b211704fff9c6a6ea_0,explicit,"These clusters of informative voxels, along with a cluster implicating the occipital cortex, have also been consistently found in neuroimaging studies using statistical parametric mapping (Bush et al., 2000; Colibazzi et al., 2010; Gerber et al., 2008; Hagan et al., 2009; Killgore and Yurgelun-Todd, 2004; Narumoto et al., 2001; Posner et al., 2009; Robins et al., 2009; Wager et al., 2008).",result,positive
49,3508,dd566508396f26150e20d2b0e772c2c33949c092>01eec8b64bf70846f67689362761a991a97693e0_1,explicit,"Combined arterial and venous thromboembolism was observed in six [14, 19, 25, 36].",background,positive
0,3344,5fa7cd8dfc1907789705613dda8328f7f6ecfc53>ad9a2a32c1d9bcbd02223eb302eceb0400b993a8_0,properNoun,"Cases were identified and clinical data collected through the Genetic Studies of Human Developmental Disorders at the Medical College of Wisconsin, Milwaukee, WI or the A/M Clinical Registry at the Albert Einstein Medical Center, Philadelphia, PA.\n Genomic DNA was extracted using the Autopure LS system (Qiagen, Valencia, CA) from blood or buccal samples and the SOX2 coding region was amplified using primers: set 1 forward, 5'-AGT CCC GGC CGG GCC GAG-3', and set 1 reverse, 5'-GGT AGC CCA GCT GGT CCT G-3', and set 2 forward, 5'-CAA GAC GCT CAT GAA GAA GG-3', and set 2 reverse, 5'-TAC TCT CCT CTT TTG CAC CC-3'.",method,neutral
1,5322,410376c6a35d3dd09a544e0b334ac4e11e22da52>bc09dfbd0300f89c727c3b5f494b326fc0bb9b15_4,explicit,"[5,6,13,14] The abdominal superficial venous dominance is one of the most extended and accepted (but not proved) hypothesis for explaining the diffuse congestion as a large diameter SIEV may denote dominance over the deep venous system.[6] Blondeel et al.",background,positive
2,5387,c20db8a8cd0649dd3644a897404c8d5100b7c707>76ae742914fa618d9008cc1c664475928843a279_7,explicit,"be involved in protein binding (especially of albumin) in other epithelia (Kopp et al., 1992; Blazejewski et al., 1997), could perform this function at the blood–CSF interface.",background,neutral
3,1793,e300bde47ff38b78bd09fc3566e9c3b5a0aa21e5>6cd197b734868a247cbe0564c4e856d68bc8652c_0,explicit,"We began the analysis with open coding that involved examining interviews line by line to document the discovery of emerging codes and their properties (Beck, 2004; Chenitz & Swanson, 1986).",method,neutral
4,776,ca4d2aef7421153f0f2c93db54a3e06a4942d329>a0ecd52bfe814e4941617cb23ba53b88a15397c7_8,explicit,Figure 3 shows the fit of the model to the dynamics of divergence and diversity of patients S-P1—SP11 [13].,background,neutral
5,6924,d9f3207db0c79a3b154f3875c9760cc6b056904b>2cc6ff899bf17666ad35893524a4d61624555ed7_8,explicit,"The maintenance of close nest burrows (King 1989b; Viblanc et al. 2010), greater tolerance (King 1989a; V.A. Viblanc, C. Pasquaretta, C. Sueur, R. Boonstra & F.S. Dobson, unpublished results) and less infanticide (Dobson 1990; Stevens 1998) between kin during this highly energy constraining period…",background,neutral
6,105,10e5b4c5db04999a8e430ea6dd6b3ef1407b6c29>70562525f30013e54641b3e4f98716f7b615d77f_2,explicit,"Previous work revealed that Dusp6 mutant mice exhibit increased pERK and Erm expression, skeletal dwarfism, craniosynostosis, and hearing loss [21].",background,neutral
7,3426,96092d14259772a441eeb6eee49bec483b4c1702>424bfebd7bcfcbb579784bdae041f926b6dce7f7_0,explicit,"A number of clinical tools have been developed for the assessment of neuropathic pain, including the neuropathic pain questionnaire (NPQ) [2], ID Pain [3] and douleur neuropathique (DN4) [4] .",background,neutral
8,4775,a987290394cf4476ea4f55f3f7bb427ff5cebf34>0c610357d8682ecc3239863bf0ccf9c8d9090381_8,explicit,"…0.07– 0.97, 0.45–4.1, 7.4–8.9, 2.97–18.92 and 12–35 mg/kg) in leafy green plants from Malaysia, Sri Lanka, China, Kathmandu, India and Turkey, respectively (Aweng et al. 2011; Kananke et al. 2014; Zhuang et al. 2009; Shakya and Khwaounjoo 2013; Yadav et al. 2013; Türkdoğan et al. 2002).",background,neutral
9,1954,4c700869e4ab2020d15d2ebec2ee0776fce3410a>6ebd21b7abe728491a59e19a177f5b539bfed7e2_7,explicit,…Comparative algorithms\nMost of exiting dynamic evolutionary algorithms were applied to moving peaks benchmark problem (MPB) (Mendes and Mohais 2005  Bui et al. 2005,method,positive
10,1414,3482f1c9c2180cd5edc1fa8bfbe2480ccaea92dd>0891bece3a201c5d0897e8b1d12264eb0b820dcd_6,explicit,"4.2 the COLD-Saarb dataset is concisely described, while detailed information can be found in (Ullah et al 2008).",background,positive
11,2033,403be1b4e5ac775d46700814b76eedce4be8441a>0f3ab6835042ea45d2aab8e4a70151c11ca9a1d6_1,explicit,Griffiths et al. (2007) demonstrate that the Topic model outperforms LSA in predicting word association and several other semantic phenomena.,background,positive
12,3414,1d7834230b65c592dd497b2bb9003000c83dc2ff>e752107ed9886fbe8a9ef3d32ef5eb3a6ca82930_2,explicit,It was anticipated that inter-individual variability would be higher in a pediatric population [14]  therefore individual variability was set at 50% for ka (as opposed to 27% in adolescents [12]).,background,positive
13,1196,dfdeea8ce2e3ef25084c297a09027e9d2bb1491e>aa53d8ec6cbe937cec842ce1f02853895ba56c3f_10,explicit,"…exercise-induced breast pain (Bridgman et al., 2010; Scurr et al., 2010), and consequently breast biomechanics research has made recommendations to wear a high level of breast support (sports bra) when exercising to reduce breast pain (Bridgman et al., 2010; Scurr et al., 2010; White et al., 2009).",background,neutral
14,3129,3c3df630c2d5fb2b331495151d523dec6e92d864>0bba94a20b2ea55cef9811ce14a31c8a6c285e5d_1,explicit,"Addition of the calcium ionophore A23187, a compound known to increase the concentration of cytosolic Ca (Reed and Lardy 1972) decreased diosgenin production in T.",background,neutral
15,6932,0c160181c3fa74d18e5b3a15cb351edd259efed4>42a0035bcddd0d0d1f8e19800e396ac4e1bc03a5_9,explicit,"Maintaining a negative DCm induces Ca 21 accumulation in mitochondria (11, 12, 19).",background,neutral
16,6893,2c383d85b2ef5322c8e219ba784a764f84911812>df518a4df25aefce4a3152902d9ce5b4712f024b_0,explicit,"These concentrations of fluoxetine and propranolol were chosen in order to represent high environmental concentrations (based on surface water, wastewater effluent, and predicted environmental concentrations) up to those shown to result in effects on fish [26–29], or where the fish plasma model [30] would predict concentrations above human therapeutic levels (Cmax).",background,positive
17,1162,41c7bdd249f2ec4747e8058a887093aa1de2adbb>None_0,explicit,"Although predicting assay success rates based on the 50% duplication estimate of Allendorf & Thorgaard (1984) is subject to errors based on a large number of factors, our results are surprisingly consistent with their estimate.",result,positive
18,1224,52db811fb230e1a19494c9ac4f293fbdfdc7d9a8>74e5f03d56f76cf3a6a80bcd977a5c7d07b42607_3,explicit,"The moonlighting functions of several canonical metabolic enzymes have been described in mammals, fungi, plants, and protozoa (12, 13, 44).",background,neutral
19,6187,f86ad40284025449a60b8b321ee8ef881370ccbd>bd76928c0ac42c36f29bea5a295297c6865b9b51_0,explicit,Human epidermal growth factor receptor type 2 (HER2) is located on chromosome 17q21 and is a transmembrane tyrosine kinase growth factor receptor [12].,background,neutral
20,7301,64cf98067d1cadda174e5ffa24fc45a6b3e6426f>2d04ac3be66a1148b0e0aeb687d0345841ca674f_5,explicit,"In support of this assumption, in ARDS patients, TRAIL levels in the BAL fluid were correlated with clinical severity and the presence of neutrophils, which are also the major infiltrating cells in reovirus 1/L-induced ARDS (20, 84).",result,positive
21,261,4d29e6f308d374381099cd0960fea27a6a04dfe6>43456ee83df5eb7339113a318a579f99a4c12e8d_0,explicit,Reports of use of other multikinase inhibitors in sarcoma such as imatinib have not been very encouraging [22] or restricted to a smaller patient sub-population such as use of crizotinib in ALK driven tumors [23].,background,negative
22,3122,df2c2410833b4a3542665c1e02a6b8c8177983fa>3baedb337055da24603a0f2ff0ec4bdc2ad381cf_1,explicit,"Most of these probably had an endobenthic lifestyle, because their morphology is similar to that of extant taxa under such conditions [Corliss, 1991; Buzas et al., 1993; Jorissen et al., 2007].",background,neutral
23,5684,e2366b504ab1f840ac595f6db2472a329e3c551b>105f4f30e7bafe7375d33a36fd878c56b94ccad1_0,explicit,"Data from 2 studies not considered in the Cal-20 bet and Landry analysis, Verity and Vernet (1992) and Olson and Strom (2002) were included.",method,neutral
24,5567,1a8040efae37c96912537ea0778bc12e70b6b793>852d2614bd7d2da447ee5e58ee72f1670ad8c887_0,explicit,"A similar pattern of CF labeling was observed with Tbx18-Cre (5), another epicardial-specific Cre driver (Supplemental Figure 4, B and C).",method,positive
25,40,e364d59a1dc537f2d51cebd7647030833629bb07>d18293e4a7b9d11f93cd5384005e289e00122f07_0,explicit,"In this chapter we will present the formalism for these different kinds of beamformers in their scalar form, then develop the formalism for a vector beamformer (Sekihara et al., 2001, Quraan and Cheyne 2010) and an eigenstate-projected vector beamformer (Sekihara et al., 2001).",background,neutral
26,6703,91ab57dad433d08593e57bfa5526317d757f51d4>c9ec516a6cfecf7f5cad640d7256af61bf8abc5d_0,explicit,"The frequency and also the mutation pattern we found were in concordance with the data from the literature (Ohashi et al, 1995).",result,positive
27,8031,a3ab23f7c76decce6b45696fb09ef8ea538df866>03a7146d3b138976303eabebbf6b9cb04172c5ac_0,explicit,It has been previously reported that chronic exposure to glucocorticoid can inhibit gonadotropin (LH and FSH) secretion as evidence by decrease responsiveness to administered GnRH and subnormal plasma testosterone.(16) LH is the hormone involved in the regulation of the steroidogenic acute regulatory (StAR) protein that deliver cholesterol to inner mitochondria for steroidogenesis in the Leydig cell.,background,neutral
28,6003,2b80f65e936e58979de232164026543edb2a79e8>8f01119d68d6a980ec1608e905be6e4f58cb328a_4,explicit,Andes have been eroded by the Patagonian ice sheet and are much lower and narrower (Garzione et al. 2008,background,neutral
29,880,9ae9e2cada91b886ecb890bdbee0e7a7a8f8dd87>b5fdec691027cb589bac14adfe45a2a95b900ef1_7,explicit,"that can destroy tumor cells but are instead induced to suppress anti-tumor immune responses by releasing elevated levels of the immune suppressive products, nitric oxide, IL10 and TGF- , and down-regulating levels of the immune stimulatory product IL-12 [10, 17, 14, 20].",background,neutral
30,978,2774380ac954a445ea2473917b7920d9c3d0b1a4>f811d63c866754e43529f218db9a44f14e317183_0,explicit,"Potassium (Kþ) channels have the greatest amount of diversity among ion channels in the plasma membrane, which are encoded by over 75 distinct genes [2].",background,neutral
31,2618,f3326b300fc5c850653c0a772658ad6925809fec>c5795d26cd9f59ab2aaa23cc4314d7ff8dabacee_0,acronymParen,"Suppression subtractive hybridization and differential hybridization screening To compare gene expression in GC collected from OF versus DF, the suppression subtractive hybridization (SSH) was performed as previously described [8].",method,neutral
32,1774,45d3de76e09c92151f3b801f09d7fc5205487be1>475d6f9a3b439ff9d2a554af66953c1ad9f341b6_1,explicit,Shi and Liu (2000) built a kind of g-band model of random line object based on stoma process.,background,neutral
33,3030,2bdcb724b605255b9d691dbf5e71f03ea38f3a3b>004906d82709ceebebf6d3b111cc97a99f445038_0,explicit,…tool for clinicians interested in understanding the impact of drug therapy on the control of HIV and the associated problem of drug resistance (Bonhoeffer et al. 1997,method,neutral
34,3660,4cdc8a32a8cdd080ba4cc64657934782ec154553>641a2907c5e94d88c60daed34f72b724719cca55_8,explicit,"3B), MBD1–3 and MBD5–6 act as two independent structural units and the orientation of MBD1-3 agrees with the data from recent small-angle X-ray scattering (SAXS) experiments (Yu et al. 2017b).",background,neutral
35,1765,d988a5477956841b26c31edb3e95d9667c17ecf7>f0aba40f2d8b2b06ef4639bf3354b4c946c6a6b5_0,explicit,"One approach, such as the three-step search (TSS)[1], and twodimensional logarithm search (TDL)[2], new three-step search (N3SS)[3], efficient three-step search (E3SS)[4], and cross search (CS)[5] employ coarse-to-fine searching to reduce the number of search points.",background,neutral
36,731,1327903921367d530e8a521f110497b0dd5dafd8>c7174b0679b8a8f05a65b1142cfea436eb2c3b46_1,explicit,"In Table 1, we also include the 40-core times for a modified version of the best publicly available parallel suffix tree code of Blelloch and Shun [2] (labeled PST).",method,positive
37,2067,f3889d2e2db6cdbe17dee9ff02b0da1d62b9cf0a>fc7a46205058ddd664b63ce428397cb76e7afe21_0,explicit,"Consistent with previous results (Koroch et al. 2002; Liu et al. 2002; Staniszewska et al. 2003; Washida et al. 2004), the addition of IBA at optimum levels enhanced the growth of HRC of Echinacea but had no effect on the production of secondary metabolites.",result,positive
38,6406,c3ed1464884353ecc0c0ad2e3685df2b0fc00474>None_0,explicit,"kestrels, Falco tinninculus [40]) have been shown to benefit from supplementary feeding, our results go further, showing that supplementary feeding alone does not fully explain the positive ramifications that we have demonstrated for vineyard habitat.",result,positive
39,4500,026b7cae6eb1dfa570ddc4100135ff7b5023b6de>0b29c289bc5f0fa7e51090d1ad00654754b68b94_4,explicit,proposed a pattern matching algorithm that reduced total memory requirements by sharing common infixes of target patterns [4].,background,positive
40,5889,51b1d73c775d19eb3ca8062946daa90df92a61e3>23922f7142f54646d7899cb81e008ea8b99442f1_1,explicit,intrauterine pregnancy.(9) We present this data in aggregate and by physician to better represent individual variation in ability to identify an intrauterine pregnancy.,background,positive
41,163,272d26ac51503e51b07735b0ad1461cbf48a19bf>a0b3d0f8ee97e24085f7cd0849f857b451704fb8_0,explicit,"Although they mimic many phorbol ester effects, including inhibition of cell-cell communication (25, 26), they have been reported not to induce differentiation of HL-60 cells (27) or to inhibit maturation of granulosa cells (28).",background,neutral
42,8004,4d9170a8daa2f40530580a24e8490f569eaf15d7>d6eaf36357406cc26c09d36fc88d8974ba49807d_5,explicit,suggested that there was little evidence of the contribution of methylation to downregulation of miR-99a [10].,background,negative
43,3476,44573614b7d8a92de278cf39c949548fd76fccd6>806b61d4884b04cb8369b8a86d85ab4fd3a5b819_3,explicit,"Instruments to evaluate the impact of hearing loss on QoL Assessment of QoL deterioration due to hearing loss can be achieved through several instruments, as reported in different studies in the literature.(8,9) These can be divided into hearing-related QoL instruments (Table 1) and generic QoL instruments.",method,neutral
44,4362,612073fb1ca5ba06b9406aa7a0f05ab33f270304>315afbe6daed80c0d32340d814dc819593c2ce14_0,explicit,"While we cannot exclude alternative models, our findings are consistent with models in which TRIM5≈í¬± engages lentiviral CA through two sets of contacts, one in the structurally conserved ≈í‚â§-hairpin and the second at the junction between binding sites of at least four cellular cofactors [25, 78, 79].",result,positive
45,7023,f9e9bef98a81a43ce7b700822e03423273186029>7b2b2256858a4d7d4a273db9dd3a643b2fadc055_3,explicit,"…allowed to walk freely for 1 h as a group inside a Petri dish (100 x 15 mm) lined with filter paper (Whatman Qualitative no. 5, particle retention > 2.5 μm) moistened with 1.0 ml of a suspension containing 2 x 10 8 conidia/ml (high dose) or 6 x 10 6 conidia/ml (low dose) (Rosengaus et al. 1998).",method,neutral
46,4762,0cb2300be5b25870c2c7e44a395676a2d9b227aa>44ab4d2c768fde6c283d6006b7799130f44e10f4_1,explicit,"Examination of plaque formation and growth curves were performed by standard methods as previously described (10, 35).",method,neutral
47,1208,16db1d1dcdc7af74006361c314f3e2d47be196cd>701c093958c3a52bafdfd6ce78a618dfa6aa70a0_0,explicit,A recent report (Teixeira et al. 2007) corroborated some of the previous observations and found that the o/w microemulsion was effective in reducing the cell numbers and preformed biofilms of five food-borne pathogens but lost all antimicrobial properties when diluted by the addition of water due‚Äö√Ñ¬∂,result,positive
48,2769,00e7e355e397eecfdc5c3b8071d0a342c3029113>770e5c093077d0677cc2c4714829bb3089ff622d_3,explicit,Fluorescence studies The GFP-PlyG fusion protein was expressed and purified as described [46].,method,neutral
49,7469,acfb184e462ba7d699472a12b257aa597cce4866>977f5797d6c37ab3084e4e7ee0024ecfcc94384d_0,acronym,"In [37], DWT coefficients in each color components are modeled jointly by Multivariate Generalized Gaussian (MGG), and geodesic distance is used as the similarity measure.",method,neutral
50,815,3243d9810e2aa3bfcd02337e40be1a7a912ecdad>6aa70abfd2a3982e48006d40da5e05e40c41d330_0,explicit,"However, our previous data on healthy paediatric patients (age 3 to 18 years) undergoing catheterisation for atrial septal defect closure resulted in a transfer function with the same peak at the fourth harmonic as demonstrated by Nichols and O’Rourke [8] suggesting the validity of this technique [9].",method,positive
